{
  "frontmatter": {
    "pen": {
      "effort": "xhigh",
      "model": "opus-5",
      "vendor": "anthropic"
    },
    "run_id": "gdm-wo2026128750a1-agent-memory-3",
    "spec_digest": "sha256:66ece496e3ffdf0320139748c01bf3f0cfdbd6d501cdd828bed02551699bf407",
    "spec_version": 1,
    "variant": "v2"
  },
  "frontmatter_raw": "run_id: gdm-wo2026128750a1-agent-memory-3\nvariant: v2\npen: { vendor: anthropic, model: opus-5, effort: xhigh }\nspec_version: 1\nspec_digest: sha256:66ece496e3ffdf0320139748c01bf3f0cfdbd6d501cdd828bed02551699bf407\n",
  "images": [
    {
      "asset_path": "30-figures/assets/fig-01.png",
      "figure": "fig-01",
      "tweet": 1
    },
    {
      "asset_path": "30-figures/assets/fig-02.png",
      "figure": "fig-02",
      "tweet": 2
    },
    {
      "asset_path": "30-figures/assets/fig-08.png",
      "figure": "fig-08",
      "tweet": 3
    },
    {
      "asset_path": "30-figures/assets/fig-07.png",
      "figure": "fig-07",
      "tweet": 3
    },
    {
      "asset_path": "30-figures/assets/fig-03.png",
      "figure": "fig-03",
      "tweet": 4
    },
    {
      "asset_path": "30-figures/assets/fig-21.png",
      "figure": "fig-21",
      "tweet": 5
    },
    {
      "asset_path": "30-figures/assets/fig-10.png",
      "figure": "fig-10",
      "tweet": 6
    },
    {
      "asset_path": "30-figures/assets/fig-01.png",
      "figure": "fig-01",
      "tweet": 7
    },
    {
      "asset_path": "30-figures/assets/fig-01.png",
      "figure": "fig-01",
      "tweet": 8
    }
  ],
  "run_id": "gdm-wo2026128750a1-agent-memory-3",
  "schema": "thread/v0",
  "spec_digest": "sha256:66ece496e3ffdf0320139748c01bf3f0cfdbd6d501cdd828bed02551699bf407",
  "spec_version": 1,
  "tweets": [
    {
      "figures": [
        "fig-01"
      ],
      "n": 1,
      "slot": "hook",
      "text": "When an AI agent says it \"remembers\" you, is that architecture or marketing?\nAgents forget, so you re-enter the same details; the claim is a loop — query plus memory data from a datastore of your past interactions, into a sequence model, out as a response.",
      "weighted_char_count": 256
    },
    {
      "figures": [
        "fig-02"
      ],
      "n": 2,
      "slot": "stop",
      "text": "This datastore is not a transcript of your chats.\nEach memory object is a container holding memory values, a string, an image, or audio, plus metadata such as a timestamp, the trigger that stored it, and a summary of the interaction it came from.",
      "weighted_char_count": 246
    },
    {
      "figures": [
        "fig-08",
        "fig-07"
      ],
      "n": 3,
      "slot": "stop",
      "text": "A model decides what to store: cached inputs go to the model system, which predicts what is worth remembering and extracts it.\nIt is stored as a memory value in a memory object, and one trigger is you asking the agent to remember your favorite architect.",
      "weighted_char_count": 254
    },
    {
      "figures": [
        "fig-03"
      ],
      "n": 4,
      "slot": "stop",
      "text": "Instead of rereading your whole history, the agent scores stored memory objects for relevance to your query.\nIt compares a query embedding to memory value embeddings by a measure such as cosine similarity, keeps a top subset, and orders them by timestamp.",
      "weighted_char_count": 255
    },
    {
      "figures": [
        "fig-21"
      ],
      "n": 5,
      "slot": "stop",
      "text": "Memories are corrected: new timestamped input is matched to the prior memory object it concerns, which is then replaced or updated.\nAligned objects can be consolidated into one, and contradicting input refines the memory instead of overwriting it.",
      "weighted_char_count": 247
    },
    {
      "figures": [
        "fig-10"
      ],
      "n": 6,
      "slot": "pivot",
      "text": "Forgetting is claimed: \"forget that\" deletes the specified information, and \"forget this after three months\" queues it for deletion.\nA maintenance cycle deletes objects past their expiration time on its own, and the chat that builds the memory erases it.",
      "weighted_char_count": 254
    },
    {
      "figures": [
        "fig-01"
      ],
      "n": 7,
      "slot": "stop",
      "text": "The model first works through your query against the recalled memory data, and that working-out can stay off the screen.\nWhat comes back can be an API call that makes a device act, so the memory shapes what the agent does, not only what it says.",
      "weighted_char_count": 245
    },
    {
      "figures": [
        "fig-01"
      ],
      "n": 8,
      "slot": "landing",
      "text": "No performance numbers are given.\nWhat is claimed is structural: memory objects made from your interactions, some on your explicit request, retrieved by relevance, corrected over time, and deleted when you ask.\nThat is a described architecture, not a slogan.",
      "weighted_char_count": 258
    },
    {
      "figures": [],
      "n": 9,
      "slot": "tail",
      "text": "The publication is WO2026-128750A1, priority 2024-12-11, published 2026-06-18.\nFollow along for the next patent walk-through.",
      "weighted_char_count": 125
    }
  ],
  "variant": "v2"
}
